[
  {
    "breach_dates": [
      "2025-08-12",
      "2025-08-13",
      "2025-08-14",
      "2025-08-15",
      "2025-08-16",
      "2025-08-17"
    ],
    "data_exposed": [],
    "deadline_status": "unknown",
    "enrollment_deadline": null,
    "enrollment_deadline_timezone": null,
    "extraction_confidence": 0.75,
    "id": "sb24-622486",
    "organization": "Access Information Management Shared Services, LLC",
    "remedy_duration_months": 24,
    "remedy_duration_text": "24 months",
    "remedy_provider": "Experian IdentityWorks",
    "remedy_type": "identity protection",
    "reported_date": "2026-04-28",
    "source_accessed_at": "2026-07-30T10:51:07Z",
    "source_notice_sha256": "0352d7ca1540b574f0905f5907ab2ce20be17017a2095d2bdab76d197dcf277b",
    "source_notice_url": "https://oag.ca.gov/system/files/L01%20-%20Access_Corp_Sample_Letter.pdf",
    "source_report_url": "https://oag.ca.gov/ecrime/databreach/reports/sb24-622486"
  },
  {
    "breach_dates": [
      "2026-04-17",
      "2026-04-22"
    ],
    "data_exposed": [
      "Date of birth",
      "Name"
    ],
    "deadline_status": "open",
    "enrollment_deadline": "2026-09-30",
    "enrollment_deadline_timezone": "UTC",
    "extraction_confidence": 1.0,
    "id": "sb24-625334",
    "organization": "AgelessRx",
    "remedy_duration_months": 12,
    "remedy_duration_text": "12 months",
    "remedy_provider": "Experian IdentityWorks",
    "remedy_type": "identity protection",
    "reported_date": "2026-06-24",
    "source_accessed_at": "2026-07-30T10:48:54Z",
    "source_notice_sha256": "e3ce97816deae77169874016bf0794c558fa9835a3c3ede531b200cb04fd90c0",
    "source_notice_url": "https://oag.ca.gov/system/files/AgelessRx%20-%20Notice%20of%20Data%20Event%20-%20CA_0.pdf",
    "source_report_url": "https://oag.ca.gov/ecrime/databreach/reports/sb24-625334"
  },
  {
    "breach_dates": [
      "2025-02-12"
    ],
    "data_exposed": [
      "Social Security number",
      "Date of birth",
      "Name"
    ],
    "deadline_status": "unknown",
    "enrollment_deadline": null,
    "enrollment_deadline_timezone": null,
    "extraction_confidence": 0.75,
    "id": "sb24-625037",
    "organization": "Alcott HR",
    "remedy_duration_months": 24,
    "remedy_duration_text": "24 months",
    "remedy_provider": "Experian",
    "remedy_type": "identity protection",
    "reported_date": "2026-06-17",
    "source_accessed_at": "2026-07-30T10:49:04Z",
    "source_notice_sha256": "39bb512ec58e552cc3754f19e21192623962d859b62db5ee0821594f24cb214f",
    "source_notice_url": "https://oag.ca.gov/system/files/L01_Alcott_Notification%20Letter_Final_revd3_Redacted.pdf",
    "source_report_url": "https://oag.ca.gov/ecrime/databreach/reports/sb24-625037"
  },
  {
    "breach_dates": [
      "2025-10-06"
    ],
    "data_exposed": [
      "Social Security number",
      "Name"
    ],
    "deadline_status": "unknown",
    "enrollment_deadline": null,
    "enrollment_deadline_timezone": null,
    "extraction_confidence": 0.75,
    "id": "sb24-622966",
    "organization": "Alliance Roofing Company, Inc.",
    "remedy_duration_months": 12,
    "remedy_duration_text": "12 months",
    "remedy_provider": "Experian",
    "remedy_type": "identity protection",
    "reported_date": "2026-05-07",
    "source_accessed_at": "2026-07-30T10:50:37Z",
    "source_notice_sha256": "eb3de6ff718bdabb272272239c8728634fa7b0b4b6586b71564484100941f562",
    "source_notice_url": "https://oag.ca.gov/system/files/Alliance_Roofing_Adult_Letter_Final_Live_Proof_R1_Redacted.pdf",
    "source_report_url": "https://oag.ca.gov/ecrime/databreach/reports/sb24-622966"
  },
  {
    "breach_dates": [
      "2026-02-03",
      "2026-02-06"
    ],
    "data_exposed": [
      "Name"
    ],
    "deadline_status": "unknown",
    "enrollment_deadline": null,
    "enrollment_deadline_timezone": null,
    "extraction_confidence": 0.5,
    "id": "sb24-626178",
    "organization": "Alta Orthopaedics Medical Group, Inc.",
    "remedy_duration_months": null,
    "remedy_duration_text": null,
    "remedy_provider": "Experian",
    "remedy_type": "identity protection",
    "reported_date": "2026-07-08",
    "source_accessed_at": "2026-07-30T10:48:16Z",
    "source_notice_sha256": "d046a80c65db4a5c540fc31c351665135a606cf1b09866a46f598d9b5629e0cd",
    "source_notice_url": "https://oag.ca.gov/system/files/Alta%20Orthopaedics%20-%20CA%20AG%20Notice%20Letter%20%26%20Exhibits%20_0.pdf",
    "source_report_url": "https://oag.ca.gov/ecrime/databreach/reports/sb24-626178"
  },
  {
    "breach_dates": [
      "2025-06-21",
      "2025-06-18"
    ],
    "data_exposed": [
      "Social Security number",
      "Driver's license number",
      "Date of birth"
    ],
    "deadline_status": "open",
    "enrollment_deadline": "2026-09-30",
    "enrollment_deadline_timezone": null,
    "extraction_confidence": 1.0,
    "id": "sb24-624771",
    "organization": "American Future Technology Corporation d/b/a iBUYPOWER",
    "remedy_duration_months": 12,
    "remedy_duration_text": "12 months",
    "remedy_provider": "Experian IdentityWorks",
    "remedy_type": "identity protection",
    "reported_date": "2026-06-12",
    "source_accessed_at": "2026-07-30T10:49:11Z",
    "source_notice_sha256": "a93641aea854aa35ab3fb9d946fcc7697c81374ebb7f0ffc424af49ecf32b96b",
    "source_notice_url": "https://oag.ca.gov/system/files/iBUYPOWER%20Notice%20Letter%206.5.26.pdf",
    "source_report_url": "https://oag.ca.gov/ecrime/databreach/reports/sb24-624771"
  },
  {
    "breach_dates": [
      "2025-07-24",
      "2025-07-26",
      "2025-07-27",
      "2025-07-30"
    ],
    "data_exposed": [
      "Social Security number",
      "Date of birth",
      "Name"
    ],
    "deadline_status": "unknown",
    "enrollment_deadline": null,
    "enrollment_deadline_timezone": null,
    "extraction_confidence": 0.75,
    "id": "sb24-623190",
    "organization": "American Lending Center",
    "remedy_duration_months": 12,
    "remedy_duration_text": "12 months",
    "remedy_provider": "Experian",
    "remedy_type": "identity protection",
    "reported_date": "2026-05-11",
    "source_accessed_at": "2026-07-30T10:50:28Z",
    "source_notice_sha256": "a97829a46c5c375811a723930bc70edf7d45aa0c6d416b3c4ec11da437b0e4db",
    "source_notice_url": "https://oag.ca.gov/system/files/American%20Lending-%20Notification%20Letter%20-%20U.S.%20Adult%20Residents%28175903957.1%29.%20pdf.pdf",
    "source_report_url": "https://oag.ca.gov/ecrime/databreach/reports/sb24-623190"
  },
  {
    "breach_dates": [
      "2026-03-21"
    ],
    "data_exposed": [],
    "deadline_status": "unknown",
    "enrollment_deadline": null,
    "enrollment_deadline_timezone": null,
    "extraction_confidence": 0.75,
    "id": "sb24-623996",
    "organization": "Ampex Data Systems Corporation",
    "remedy_duration_months": 12,
    "remedy_duration_text": "12 months",
    "remedy_provider": "Experian",
    "remedy_type": "identity protection",
    "reported_date": "2026-05-27",
    "source_accessed_at": "2026-07-30T10:49:56Z",
    "source_notice_sha256": "9c0985810932cabc1c3ad5c4b40950ad07302871e7d17f65366b244bd3909f72",
    "source_notice_url": "https://oag.ca.gov/system/files/Ampex%20Notification%20Letter.pdf",
    "source_report_url": "https://oag.ca.gov/ecrime/databreach/reports/sb24-623996"
  },
  {
    "breach_dates": [
      "2026-05-15"
    ],
    "data_exposed": [],
    "deadline_status": "unknown",
    "enrollment_deadline": null,
    "enrollment_deadline_timezone": null,
    "extraction_confidence": 0.75,
    "id": "sb24-625610",
    "organization": "AssetMark, Inc.",
    "remedy_duration_months": 24,
    "remedy_duration_text": "24 months",
    "remedy_provider": "Experian",
    "remedy_type": "identity protection",
    "reported_date": "2026-06-26",
    "source_accessed_at": "2026-07-30T10:48:40Z",
    "source_notice_sha256": "ef1ec0eeb94b8e14ff015b0d64dd8aa7d8d03a1903f667e5723619a09c1058cd",
    "source_notice_url": "https://oag.ca.gov/system/files/Sample%20Notice_36.pdf",
    "source_report_url": "https://oag.ca.gov/ecrime/databreach/reports/sb24-625610"
  },
  {
    "breach_dates": [
      "2026-03-16",
      "2026-03-17"
    ],
    "data_exposed": [
      "Driver's license number",
      "Name"
    ],
    "deadline_status": "unknown",
    "enrollment_deadline": null,
    "enrollment_deadline_timezone": null,
    "extraction_confidence": 0.75,
    "id": "sb24-625034",
    "organization": "AssuranceAmerica Managing General Agency, LLC",
    "remedy_duration_months": 12,
    "remedy_duration_text": "12 months",
    "remedy_provider": "Experian",
    "remedy_type": "identity protection",
    "reported_date": "2026-06-17",
    "source_accessed_at": "2026-07-30T10:49:05Z",
    "source_notice_sha256": "eade21a1455181c02fa9f23dba2a6e052c3d1d2762128a19e88b86b95cbbcec3",
    "source_notice_url": "https://oag.ca.gov/system/files/AA%20-%20Individual%20Notice%20Letter%20-%20CA.pdf",
    "source_report_url": "https://oag.ca.gov/ecrime/databreach/reports/sb24-625034"
  },
  {
    "breach_dates": [
      "2025-07-10",
      "2025-08-19"
    ],
    "data_exposed": [
      "Name"
    ],
    "deadline_status": "unknown",
    "enrollment_deadline": null,
    "enrollment_deadline_timezone": null,
    "extraction_confidence": 0.75,
    "id": "sb24-623158",
    "organization": "Automobile Club of Southern California",
    "remedy_duration_months": 12,
    "remedy_duration_text": "12 months",
    "remedy_provider": "Experian",
    "remedy_type": "identity protection",
    "reported_date": "2026-05-08",
    "source_accessed_at": "2026-07-30T10:50:29Z",
    "source_notice_sha256": "1bf70addbbda7092b39a2c204de0cc95b0ec89d2778263fcb9e538b524b7c6af",
    "source_notice_url": "https://oag.ca.gov/system/files/ACSC_CA%20App%20%26%20Sample_1_0.pdf",
    "source_report_url": "https://oag.ca.gov/ecrime/databreach/reports/sb24-623158"
  },
  {
    "breach_dates": [
      "2026-03-02"
    ],
    "data_exposed": [
      "Name"